amazon link,amazon product group,audience,cinematographer,composer,condition,conductor,country,cover color,creation date,creator,current value,dewey decimal,EAN,edition,features,format,genres,height,illustrator,ISBN,item type,key,languages,length,library of congress,location,maximum players,minimum players,net rating,no. in series,no. of items,notes,owner,pages,platform,played / read,primary synopsis,private,publisher,purchase date,purchase price,rare,rating,release date,retail price,running time,screenwriter,serial number,series,shelves,signed,stars,subtitle,theatrical debut,title,tracks,unique item key,url,used,weight,width,your image URL
4094803149,,,,,,,us,"grey, brown, tan, light brown, beige, purple, mauve, pink, white, dark grey, light grey, lavender, light blue, blue, light pink, dark purple",2014-05-22 17:35:51 +0000,,,,,,,,,0,,,Book,,,0,,,0,0,0,0,1,,,0,,0,,0,,2014-05-22 17:35:51 +0000,,0,0,,,0,,,,,0,,,,,,28D58D90-9119-4795-BC45-B281AAC8DD9E,,0,0,0,
4861008697,,,,,,,us,"grey, blue, beige, pink, tan, teal, purple, green, light pink, brown, mauve",2014-05-22 17:08:21 +0000,,,,,,,,,0,,978-4-86100-869-6,Book,,,0,,,0,0,0,0,1,,,0,,0,,0,,2014-05-22 17:08:21 +0000,,0,0,,,0,,,,,0,,,,Beyond Interaction,,CD361BA6-9488-4B7B-9793-884F4721E8A0,,0,0,0,
1934105902,Book,,,,,,us,"black, brown, dark green, grey, green, dark brown, forest green, dark grey, dark purple, white, olive green, dark blue",2014-05-22 17:22:26 +0000,,$32.29,,9781934105900,,,Paperback,"Arts & Photography, Reference",0.47,,1934105902,Book,,"English (Unknown), English (Original Language), English (Published)",9.130000000000001,,,0,0,0,0,1,,,0,,0,,0,Sternberg Press,2014-05-22 17:22:26 +0000,,0,0,2012-01-31 05:00:00 +0000,$27.38,0,,,,,0,,,,Bulletins of the Serving Library #2,,4AD139B2-974C-4B50-AB22-D7911D165BDA,,0,0.79,6.46,http://ecx.images-amazon.com/images/I/51yT0SEdueL.jpg
3943365581,Book,,,,,,us,"grey, green, white, olive green, light grey, light green, light blue, pink, pale blue, pale green, light pink, lavender, dark grey, beige",2014-05-22 17:08:18 +0000,,$38.71,,9783943365580,,,Paperback,"Arts & Photography, Reference",0.55,,3943365581,Book,,"English (Unknown), English (Original Language), English (Published)",9.210000000000001,,,0,0,0,0,1,,,200,,0,,0,Sternberg Press,2014-05-22 17:08:18 +0000,,0,0,2012-12-01 05:00:00 +0000,$38.45,0,,,,,0,,,,Bulletins of the Serving Library #4,,E2143A28-65CE-4D94-9A06-E06CBBD24AA6,,0,1.01,6.46,http://ecx.images-amazon.com/images/I/51RqPPeTyCL.jpg
,,,,,,,us,"grey, purple, blue, black, dark purple, white, lavender, pink, dark blue, light blue, navy blue, light purple, light pink, dark grey, mauve, pale blue, light grey, brown",2014-05-22 17:18:37 +0000,,,,9770961970148,,,,,0,,,Book,,,0,,,0,0,0,0,1,,,0,,0,,0,,2014-05-22 17:18:37 +0000,,0,0,,,0,,,,,0,,,,Dazed & Confused III/26,,103A26E6-FAC8-40E3-B5AB-648DAF68B87D,,0,0,0,
B008BIA9MC,CE,,,,,,us,"blue, dark blue, navy blue, grey, light blue, navy, white, sky blue, pale blue, black",2014-05-22 17:18:28 +0000,,,,0082039558868,,,Electronics,Categories,0,,,Gadget,,,0,,,0,0,0,0,1,,,0,,0,"Sooner or later, all game programmers run into coding issues that require an understanding of mathematics or physics concepts such as collision detection, 3D vectors, transformations, game theory, or basic calculus. Unfortunately, most programmers frequently have a limited understanding of these essential mathematics and physics concepts. MATHEMATICS AND PHYSICS FOR PROGRAMMERS,THIRD EDITION provides a simple but thorough grounding in the mathematics and physics topics that programmers require to write algorithms and programsusing a non-language-specific approach. Applications and examples from game programming are included throughout, and exercises follow each chapter for additional practice. The book's companion website provides sample code illustrating the mathematical and physics topics discussed in the book.",0,Cengage,2014-05-22 17:18:28 +0000,,0,0,,$14.99,0,,,,,0,,,,MATHEMATICS AND PHYSICS FOR PR,,43635B2C-457A-4D2E-B3C8-C12152981AE0,,0,4.05,0,http://ecx.images-amazon.com/images/I/41YMKGk8wTL.jpg
4568503655,Book,,,,,,us,"black, brown, dark brown, dark purple, dark green, grey",2014-05-22 21:07:20 +0000,,$35.10,,9784568503654,,,Tankobon Hardcover,Subjects,1.1,,4568503655,Book,,,8.619999999999999,,,0,0,0,0,1,,,0,,0,,0,,2014-05-22 21:07:20 +0000,,0,0,,$55.94,0,,,,,0,,,,Sabun: Sa O Toru Koto De Atarashii Nanika Ga Umareru,,899D6C7D-40C2-4AA2-B428-BD7BF5F5BD4C,,0,1.31,5.91,http://ecx.images-amazon.com/images/I/31FJxYo5KaL.jpg
,,,,,,,us,"grey, lavender, purple, light blue, light purple, blue, dark blue, navy blue, black, dark purple",2014-05-22 21:05:29 +0000,,,,,,,,,0,,,Book,,,0,,,0,0,0,0,1,,,0,,0,,0,,2014-05-22 21:05:29 +0000,,0,0,,,0,,,,,0,,,,School for Poetic Computation Spring 2014 Zine,,A68A7F09-2529-4308-89B1-1E27923DE14D,,0,0,0,
4763010298,Book,,,,,,us,"light blue, grey, pale blue, sky blue, white, blue, light grey",2014-05-22 17:10:03 +0000,,$63.67,,9784763010292,,,JP Oversized,Subjects,0.63,,4763010298,Book,,Japanese (Original Language),10.24,,,0,0,0,0,1,,,0,,0,,0,,2014-05-22 17:10:03 +0000,,0,0,,,0,,,,,0,,,,Zokusei,,01BAE9CC-2A72-4A3E-BF81-E9203759AEF8,,0,1.54,7.24,http://ecx.images-amazon.com/images/I/31PL-PEVwQL.jpg
8496263053,Book,,,,,,us,"blue, light blue, grey, white, black, sky blue, dark blue, pale blue, purple, dark purple, brown, navy blue, pink, light pink, dark grey, dark brown, periwinkle, dark green",2014-05-22 17:40:06 +0000,Marta Rojals Del Alamo,$55.00,,9788496263055,,,Hardcover,"Arts & Photography, Engineering & Transportation",1,,8496263053,Book,,"English (Unknown), English (Original Language), English (Published)",9,,,0,0,0,0,1,,,299,,0,A selection of imaginative solutions in playground design that combine the needs of creating an entertaining environment and an aesthetically pleasing public space.,0,Links Internacional,2014-05-22 17:40:06 +0000,,0,0,2005-01-01 05:00:00 +0000,$39.95,0,,,,,0,,,,Design for Fun: Playgrounds,,0BB4A2FB-8F1B-4B94-ACDC-75FCB0A5FCD7,,0,0.66,9,http://ecx.images-amazon.com/images/I/515W57EJT5L.jpg
0988927802,Book,,,,,,us,"blue, light blue, sky blue, black, dark blue, navy blue, teal, white, dark green, grey, pale blue",2014-05-22 17:37:13 +0000,Alex Allain,$34.83,,9780988927803,,,Paperback,"Computers & Technology, Reference",1.42,,0988927802,Book,,"English (Unknown), English (Original Language), English (Published)",9.130000000000001,,,0,0,0,0,1,,,536,,0,"Want to learn to code? Want to learn C++? Struggling to follow your lecturer or books and tutorials written for experts? You're not alone. As a professional C++ developer and former Harvard teaching fellow, I know what you need to know to be a great C++ programmer, and I know how to teach it, one step at a time. I know where people struggle, and why, and how to make it clear. I cover every step of the programming process, including:Getting the tools you need to program and how to use themBasic language feature like variables, loops and functionsHow to go from an idea to codeA clear, understandable explanation of pointersStrings, file IO, arrays, referencesClasses and advanced class designC++-specific programming patternsObject oriented programmingData structures and the standard template library (STL)Key concepts are reinforced with quizzes and over 75 practice problems.",0,Cprogramming.com,2014-05-22 17:37:13 +0000,,0,0,2013-04-19 04:00:00 +0000,$34.99,0,,,,,0,,,,Jumping into C++,,E01B30AA-93AC-4CFD-98F6-2F7FC92359F3,,0,2.01,7.48,http://ecx.images-amazon.com/images/I/51yTslb11qL.jpg
9063690622,Book,,,,,,us,"tan, yellow, beige, brown, olive green, green, grey, light brown, black, dark brown, blue, orange, dark green",2014-05-22 17:24:24 +0000,"Ed Annink, Ineke Schwartz",$29.61,,9789063690625,,,Perfect Paperback,Arts & Photography,0.9,,9063690622,Book,,"English (Unknown), English (Original Language), English (Published)",9.300000000000001,,,0,0,0,0,1,,,240,,0,"Tight, clean copy, inside pristine, light cover wear, Qualifies for FREE SHIPPING!!",0,Gingko Press,2014-05-22 17:24:24 +0000,,0,0,2004-06-01 04:00:00 +0000,$45.00,0,,,,,0,,,,"Bright Minds, Beautiful Ideas: Parallel Thoughts in Different Times",,781B6A77-EBDA-4B3A-883F-751F0B614D68,,0,1.4,6.6,http://ecx.images-amazon.com/images/I/41AFNTW664L.jpg
0870707965,Book,,,,,,us,"white, pink, grey, black, light blue, light pink, orange, purple, pale blue, tan, magenta, brown, red, beige, blue, green, cream, dark grey, yellow, dark purple, olive green",2014-05-22 17:24:39 +0000,"Paola Antonelli, Jamer Hunt, Alexandra Midal",$14.79,,9780870707964,,,Paperback,Arts & Photography,0.7,,0870707965,Book,,"English (Unknown), English (Original Language), English (Published)",10.4,,,0,0,0,0,1,,,208,,0,"Since the introduction of the personal computer in the early 1980s, many objects have been designed to have capabilities well beyond their immediate use or appearance. Whether openly and actively or in subtle, subliminal ways, these objects talk to us, and we have come to expect interaction with them. Contemporary designers, besides giving objects form and function, write their initial scripts--the foundation for useful and satisfying conversations. Talk to Me focuses on projects that involve such direct interaction--including interfaces, websites, video games, devices and tools, and information systems--as well as installations that establish practical, emotional, or even sensual connections to cities, companies, governmental institutions, or other individuals. The featured objects range in date from the late 1980s to today, with particular attention given to the last five years and projects currently in development. Organized thematically, Talk to Meintroduces design practices that are increasingly crucial to our world and demonstrates how rich and deep the influence of design will be on our future.",0,"The Museum of Modern Art, New York",2014-05-22 17:24:39 +0000,,0,0,2011-07-31 04:00:00 +0000,$35.00,0,,,,,0,,,,Talk to Me: Design and the Communication between People and Objects,,393BDE26-7FF2-44EC-9009-F470E59D2902,,0,2.2,9,http://ecx.images-amazon.com/images/I/51ZM2h3OLoL.jpg
1893115232,Book,,,,,,us,"blue, purple, dark blue, light blue, sky blue, grey, white, black, dark purple, beige, tan, lavender, pale blue, navy blue, peach, pink, cream, light pink, light purple, light grey",2014-05-22 20:52:29 +0000,Dan Appleman,$0.28,,9781893115231,1,,Paperback,"Computers & Technology, Reference, Science & Math",0.59,,1893115232,Book,,"French (Unknown), English (Original Language), English (Published)",10.43,,,0,0,0,0,1,,,225,,0,"Just as children must learn the alphabet before they can read, future programmers must understand certain concepts before they can write their first program. This unique book uses full-color illustrations to help you truly understand the underlying computer science on which all programming is based., , Veteran programmer Dan Appleman provides a comprehensive, easy-to-understand explanation of computer programming, starting from a basic description of what a computer language is to coverage of how Internet programming works. The book shows you how to turn ideas into code and how to use algorithms to accomplish common tasks, and describes the basic function of compilers and interpreters. What you’ll learn Who this book is for, , Curious readers of any age will find an accessible yet comprehensive explanation of a field that has revolutionized the way we live and work.",0,Apress,2014-05-22 20:52:29 +0000,,0,0,2000-05-18 04:00:00 +0000,$29.95,0,,,,,0,,(Technology in Action Series),,How Computer Programming Works,,DCBF29EC-6956-4E64-A00A-08605AA6993C,,0,1.77,8.66,http://ecx.images-amazon.com/images/I/414W92B9RAL.jpg
147830054X,Book,,,,,,us,"white, grey, pink, light blue, light pink, pale blue, black, dark grey, orange, light grey, purple, brown, dark purple",2014-05-22 17:24:24 +0000,Jeff Atwood,$12.66,,9781478300540,,,Paperback,"Business & Money, Computers & Technology",0.9399999999999999,,147830054X,Book,,"English (Unknown), English (Original Language), English (Published)",10.94,,,0,0,0,0,1,,,278,,0,"ABOUT THE BOOK Jeff Atwood began the Coding Horror blog in 2004, and is convinced that it changed his life. He needed a way to keep track of software development over time - whatever he was thinking about or working on. He researched subjects he found interesting, then documented his research with a public blog post, which he could easily find and refer to later. Over time, increasing numbers of blog visitors found the posts helpful, relevant and interesting. Now, approximately 100,000 readers visit the blog per day and nearly as many comment and interact on the site. Effective Programming: More Than Writing Code is your one-stop shop for all things programming. Jeff writes with humor and understanding, allowing for both seasoned programmers and newbies to appreciate the depth of his research. From such posts as ""The Programmer's Bill of Rights"" and ""Why Cant Programmers... Program?"" to ""Working With the Chaos Monkey,"" this book introduces the importance of writing responsible code, the logistics involved, and how people should view it more as a lifestyle than a career. TABLE OF CONTENTS - Introduction - The Art of Getting Shit Done - Principles of Good Programming - Hiring Programmers the Right Way - Getting Your Team to Work Together - The Batcave: Effective Workspaces for Programmers - Designing With the User in Mind - Security Basics: Protecting Your Users' Data - Testing Your Code, So it Doesn't Suck More Than it Has To - Building, Managing and Benefiting from a Community - Marketing Weasels and How Not to Be One - Keeping Your Priorities Straight EXCERPT FROM THE BOOK As a software developer, you are your own worst enemy. The sooner you realize that, the better off you'll be.I know you have the best of intentions. We all do. We're software developers; we love writing code. It's what we do. We never met a problem we couldn't solve with some duct tape, a jury-rigged coat hanger and a pinch of code. But Wil Shipley argues that we should rein in our natural tendencies to write lots of code: The fundamental nature of coding is that our task, as programmers, is to recognize that every decision we make is a trade-off. To be a master programmer is to understand the nature of these trade-offs, and be conscious of them in everything we write.In coding, you have many dimensions in which you can rate code: Brevity of codeFeaturefulnessSpeed of executionTime spent codingRobustnessFlexibility Now, remember, these dimensions are all in opposition to one another. You can spend three days writing a routine which is really beautiful and fast, so you've gotten two of your dimensions up, but you've spent three days, so the ""time spent coding"" dimension is way down.So, when is this worth it? How do we make these decisions? The answer turns out to be very sane, very simple, and also the one nobody, ever, listens to: Start with brevity. Increase the other dimensions as required by testing. I couldn't agree more. I've given similar advice when I exhorted developers to Code Smaller. And I'm not talking about a reductio ad absurdum contest where we use up all the clever tricks in our books to make the code fit into less physical space. I'm talking about practical, sensible strategies to reduce the volume of code an individual programmer has to read to understand how a program works. Here's a trivial little example of what I'm talking about: if (s == String.Empty)if (s == """") It seems obvious to me that the latter case is... ...buy the book to read more!",0,CreateSpace Independent Publishing Platform,2014-05-22 17:24:24 +0000,,0,0,2012-07-04 04:00:00 +0000,$11.95,0,,,,,0,,,,Effective Programming: More Than Writing Code,,B17703EF-3E77-4C75-8A1F-7A253F75FBBA,,0,1.43,8.5,http://ecx.images-amazon.com/images/I/41xDJ0SVCML.jpg
1849517827,Book,,,,,,us,"black, green, olive green, orange, brown, dark green, grey, light green, dark purple, tan, forest green, dark brown, dark blue, navy blue, beige",2014-05-22 17:07:43 +0000,"Daniel Lélis Baggio, Shervin Emami, David Millán Escrivá, Khvedchenia Ievgen, Naureen Mahmood, Jasonl Saragih, Roy Shilkrot",$36.45,,9781849517829,,,Paperback,"Computers & Technology, Reference",0.9399999999999999,,1849517827,Book,,"English (Unknown), English (Original Language), English (Published)",9.130000000000001,,,0,0,0,0,1,,,340,,0,"Step-by-step tutorials to solve common real-world computer vision problems for desktop or mobile, from augmented reality and number plate recognition to face recognition and 3D head tracking, , OverviewAllows anyone with basic OpenCV experience to rapidly obtain skills in many computer vision topics, for research or commercial useEach chapter is a separate project covering a computer vision problem, written by a professional with proven experience on that topic.All projects include a step-by-step tutorial and full source-code, using the C++ interface of OpenCV., , In Detail, , Computer Vision is fast becoming an important technology and is used in Mars robots, national security systems, automated factories, driver-less cars, and medical image analysis to new forms of human-computer interaction. OpenCV is the most common library for computer vision, providing hundreds of complex and fast algorithms. But it has a steep learning curve and limited in-depth tutorials., , Mastering OpenCV with Practical Computer Vision Projects is the perfect book for developers with just basic OpenCV skills who want to try practical computer vision projects, as well as the seasoned OpenCV experts who want to add more Computer Vision topics to their skill set or gain more experience with OpenCV's new C++ interface before migrating from the C API to the C++ API., , Each chapter is a separate project including the necessary background knowledge, so try them all one-by-one or jump straight to the projects you're most interested in., , Create working prototypes from this book including real-time mobile apps, Augmented Reality, 3D shape from video, or track faces & eyes, fluid wall using Kinect, number plate recognition and so on., , Mastering OpenCV with Practical Computer Vision Projects gives you rapid training in nine computer vision areas with useful projects., , What you will learn from this bookPerform Face Analysis including simple Face & Eye & Skin Detection, Fisherfaces Face Recognition, 3D Head Orientation, complex Facial Feature Tracking.Do Number Plate Detection and Optical Character Recognition (OCR) using Artificial Intelligence (AI) methods including SVMs and Neural NetworksLearn Augmented Reality for desktop and iPhone or iPad using simple artificial markers or complex markerless natural imagesGenerate a 3D object model by moving a plain 2D camera, using 3D Structure from Motion (SfM) camera reprojection methodsRedesign desktop real-time computer vision applications to more suitable Android & iOS mobile appsUse simple image filter effects including cartoon, sketch, paint, and alien effectsExecute Human-Computer Interaction with an XBox Kinect sensor using the whole body as a dynamic input, , Approach, , Each chapter in the book is an individual project and each project is constructed with step-by-step instructions, clearly explained code, and includes the necessary screenshots., , Who this book is written for, , You should have basic OpenCV and C/C++ programming experience before reading this book, as it is aimed at Computer Science graduates, researchers, and computer vision experts widening their expertise.",0,Packt Publishing,2014-05-22 17:07:43 +0000,,0,0,2012-12-03 05:00:00 +0000,$44.99,0,,,,,0,,,,Mastering OpenCV with Practical Computer Vision Projects,,62A6457C-9840-4C80-8691-09A490A61365,,0,1.29,7.48,http://ecx.images-amazon.com/images/I/5175kdB4o8L.jpg
1568814348,Book,,,,,,us,"green, light green, purple, grey, olive green, pink, brown, lime green, magenta, black, white, blue, tan",2014-05-22 17:39:34 +0000,"Mike Bailey, Steve Cunningham",$54.98,,9781568814346,2,Used Book in Good Condition,Hardcover,Computers & Technology,1.02,,1568814348,Book,,"English (Unknown), English (Original Language), English (Published)",9.289999999999999,,,0,0,0,0,1,,,518,,0,"Graphics Shaders: Theory and Practice is intended for a second course in computer graphics at the undergraduate or graduate level, introducing shader programming in general, but focusing on the GLSL shading language. While teaching how to write programmable shaders, the authors also teach and reinforce the fundamentals of computer graphics. The second edition has been updated to incorporate changes in the OpenGL API (OpenGL 4.x and GLSL 4.x0) and also has a chapter on the new tessellation shaders, including many practical examples., , The book starts with a quick review of the graphics pipeline, emphasizing features that are rarely taught in introductory courses, but are immediately exposed in shader work. It then covers shader-specific theory for vertex, tessellation, geometry, and fragment shaders using the GLSL 4.x0 shading language. The text also introduces the freely available glman tool that enables you to develop, test, and tune shaders separately from the applications that will use them. The authors explore how shaders can be used to support a wide variety of applications and present examples of shaders in 3D geometry, scientific visualization, geometry morphing, algorithmic art, and more., , Features of the Second Edition:, , Written using the most recent specification releases (OpenGL 4.x and GLSL 4.x0) including code examples brought up-to-date with the current standard of the GLSL language.More examples and more exercisesA chapter on tessellation shadersAn expanded Serious Fun chapter with examples that illustrate using shaders to produce fun effectsA discussion of how to handle the major changes occurring in the OpenGL standard, and some C++ classes to help you manage that transition, , The authors thoroughly explain the concepts, use sample code to describe details of the concepts, and then challenge you to extend the examples. They provide sample source code for many of the book’s examples at www.cgeducation.org",0,A K Peters/CRC Press,2014-05-22 17:39:34 +0000,,0,0,2011-11-08 05:00:00 +0000,$87.95,0,,,,,0,,,,"Graphics Shaders: Theory and Practice, Second Edition",,9ADCAE34-A586-46F2-945A-36348BE6A052,,0,2.65,8.029999999999999,http://ecx.images-amazon.com/images/I/51ATLRevR7L.jpg
3943365182,Book,,,,,,us,"grey, black, white, light blue, light grey, pink, blue, green, dark green, dark blue, purple, light pink, navy blue, dark grey, dark purple, lavender, pale blue, forest green, brown, light purple, teal",2014-05-22 20:49:42 +0000,"Stuart Bailey, Angie Keefer, David Reinfurt",$24.25,,9783943365184,,,Paperback,Arts & Photography,0.79,,3943365182,Book,,"English (Original Language), English (Published)",9.210000000000001,,,0,0,0,0,1,,,224,,0,How to do words with things.,0,Sternberg Press,2014-05-22 20:49:42 +0000,,0,0,2012-08-15 04:00:00 +0000,$25.00,0,,,,,0,,,,Bulletins of the Serving Library #3,,C482CBF3-8DCE-4CF1-84F7-B7DD6D7D8E89,,0,1.15,6.54,http://ecx.images-amazon.com/images/I/51pw8UqdoiL.jpg
1449309879,Book,,,,,,us,"white, grey, light blue, pink, blue, yellow, sky blue, light pink, pale blue, orange, light grey, red, dark grey",2014-05-22 17:35:31 +0000,Massimo Banzi,$4.15,,9781449309879,Second Edition,Used Book in Good Condition,Paperback,"Computers & Technology, Reference",0.47,,1449309879,Book,,"English (Unknown), English (Original Language), English (Published)",8.35,,,0,0,0,0,1,,,128,,0,"Arduino is the open-source electronics prototyping platform that’s taken the design and hobbyist world by storm. This thorough introduction, updated for Arduino 1.0, gives you lots of ideas for projects and helps you work with them right away. From getting organized to putting the final touches on your prototype, all the information you need is here!, , Inside, you’ll learn about: Interaction design and physical computingThe Arduino hardware and software development environmentBasics of electricity and electronicsPrototyping on a solderless breadboardDrawing a schematic diagram, , Getting started with Arduino is a snap. To use the introductory examples in this guide, all you need an Arduino Uno or earlier model, along with USB A-B cable and an LED. The easy-to-use Arduino development environment is free to download., , Join hundreds of thousands of hobbyists who have discovered this incredible (and educational) platform. Written by the co-founder of the Arduino project, Getting Started with Arduino gets you in on all the fun!",0,"Maker Media, Inc",2014-05-22 17:35:31 +0000,,0,0,2011-09-23 04:00:00 +0000,$14.99,0,,,,,0,,,,Getting Started with Arduino,,9703854E-96AF-4984-ABEA-1A8FE71B3CE4,,0,0.35,5.43,http://ecx.images-amazon.com/images/I/51ynCfHwnUL.jpg
