amazon link,amazon product group,audience,cinematographer,composer,condition,conductor,country,cover color,creation date,creator,current value,dewey decimal,EAN,edition,features,format,genres,height,illustrator,ISBN,item type,key,languages,length,library of congress,location,maximum players,minimum players,net rating,no. in series,no. of items,notes,owner,pages,platform,played / read,primary synopsis,private,publisher,purchase date,purchase price,rare,rating,release date,retail price,running time,screenwriter,serial number,series,shelves,signed,stars,subtitle,theatrical debut,title,tracks,unique item key,url,used,weight,width,your image URL
0262541998,Book,,,,,,us,"pink, magenta, hot pink, orange, brown, red, fuchsia, black, yellow, salmon, maroon, purple, dark brown, dark purple",2014-05-22 17:08:27 +0000,Anthony Dunne,$12.99,,9780262541992,,,Paperback,"Arts & Photography, Engineering & Transportation, Science & Math, Politics & Social Sciences",0.47,,0262541998,Book,,"English (Unknown), English (Original Language), English (Published)",8.58,,,0,0,0,0,1,,,192,,0,"As our everyday social and cultural experiences are increasingly mediated by electronic products--from ""intelligent"" toasters to iPods--it is the design of these products that shapes our experience of the ""electrosphere"" in which we live. Designers of electronic products, writes Anthony Dunne in Hertzian Tales, must begin to think more broadly about the aesthetic role of electronic products in everyday life. Industrial design has the potential to enrich our daily lives--to improve the quality of our relationship to the artificial environment of technology, and even, argues Dunne, to be subverted for socially beneficial ends.The cultural speculations and conceptual design proposals in Hertzian Tales are not utopian visions or blueprints; instead, they embody a critique of present-day practices, ""mixing criticism with optimism."" Six essays explore design approaches for developing the aesthetic potential of electronic products outside a commercial context--considering such topics as the post-optimal object and the aesthetics of user-unfriendliness--and five proposals offer commentary in the form of objects, videos, and images. These include ""Electroclimates,"" animations on an LCD screen that register changes in radio frequency; ""When Objects Dream...,"" consumer products that ""dream"" in electromagnetic waves; ""Thief of Affection,"" which steals radio signals from cardiac pacemakers; ""Tuneable Cities,"" which uses the car as it drives through overlapping radio environments as an interface of hertzian and physical space; and the ""Faraday Chair: Negative Radio,"" enclosed in a transparent but radio-opaque shield.Very little has changed in the world of design since Hertzian Tales was first published by the Royal College of Art in 1999, writes Dunne in his preface to this MIT Press edition: ""Design is not engaging with the social, cultural, and ethical implications of the technologies it makes so sexy and consumable."" His project and proposals challenge it to do so.",0,The MIT Press,2014-05-22 17:08:27 +0000,,0,0,2008-09-26 04:00:00 +0000,$19.95,0,,,,,0,,,,"Hertzian Tales: Electronic Products, Aesthetic Experience, and Critical Design",,51E52E0B-209A-42E0-B8A1-098203AEAC00,,0,0.8,6.69,http://ecx.images-amazon.com/images/I/41vQH7kOjuL.jpg
4887522355,Book,,,,,,us,"white, grey, pink, light pink, light blue, pale blue, black",2014-05-22 17:18:01 +0000,Euphrates,$58.76,,9784887522350,,,JP Oversized,Subjects,0.63,,4887522355,Book,,,9.369999999999999,,,0,0,0,0,1,,,0,,0,ISBN: 4887522355 [Japanese Import],0,DNP Art Communications,2014-05-22 17:18:01 +0000,,0,0,0010-01-01 05:00:00 +0000,$61.21,0,,,,,0,,,,EUPHRATES BOOK (2010) ISBN: 4887522355 [Japanese Import],,77B4F053-731A-4B02-9A76-78A0609D3DD6,,0,0.97,6.77,http://ecx.images-amazon.com/images/I/41r4zPIXyWL.jpg
0596807732,Book,,,,,,us,"grey, green, olive green, black, dark grey, brown, purple, dark purple, white, dark green, light grey",2014-05-22 21:04:27 +0000,Robert Faludi,$14.99,,9780596807733,1,"ISBN13: 9780596807733, Condition: New",Paperback,Computers & Technology,0.39,,0596807732,Book,,"English (Unknown), English (Original Language), English (Published)",9.130000000000001,,,0,0,0,0,1,,,322,,0,"Get ready to create distributed sensor systems and intelligent interactive devices using the ZigBee wireless networking protocol and Series 2 XBee radios. By the time you're halfway through this fast-paced, hands-on guide, you'll have built a series of useful projects, including a complete ZigBee wireless network that delivers remotely sensed data., , Radio networking is creating revolutions in volcano monitoring, performance art, clean energy, and consumer electronics. As you follow the examples in each chapter, you'll learn how to tackle inspiring projects of your own. This practical guide is ideal for inventors, hackers, crafters, students, hobbyists, and scientists. Investigate an assortment of practical and intriguing project ideasPrep your ZigBee toolbox with an extensive shopping list of parts and programsCreate a simple, working ZigBee network with XBee radios in less than two hours -- for under $100Use the Arduino open source electronics prototyping platform to build a series of increasingly complex projectsGet familiar with XBee's API mode for creating sensor networksBuild fully scalable sensing and actuation systems with inexpensive componentsLearn about power management, source routing, and other XBee technical nuancesMake gateways that connect with neighboring networks, including the Internet",0,O'Reilly Media,2014-05-22 21:04:27 +0000,,0,0,2011-01-03 05:00:00 +0000,$34.99,0,,,,,0,,,,"Building Wireless Sensor Networks: with ZigBee, XBee, Arduino, and Processing",,960EA0CD-E6EF-4E0A-AD9F-5C69AF65FD46,,0,1.15,6.93,http://ecx.images-amazon.com/images/I/517dGlYvgxL.jpg
0714834491,Book,,,,,,us,"grey, white, light grey, light blue, pink, lavender, light pink, pale blue, black, dark grey, brown, light purple, red, purple",2014-05-22 21:17:39 +0000,Alan Fletcher,$13.25,,9780714834498,0,Used Book in Good Condition,Hardcover,"Arts & Photography, Humor & Entertainment, Reference, Teen & Young Adult",2.52,,0714834491,Book,,"English (Unknown), English (Original Language), English (Published)",9.92,,,0,0,0,0,1,,,534,,0,"The Art of Looking Sideways is a primer in visual intelligence, an exploration of the workings of the eye, the hand, the brain and the imagination. It is an inexhaustible mine of anecdotes, quotations, images, curious facts and useless information, oddities, serious science, jokes and memories, all concerned with the interplay between the verbal and the visual, and the limitless resources of the human mind. Loosely arranged in 72 chapters, all this material is presented in a wonderfully inventive series of pages that are themselves masterly demonstrations of the expressive use of type, space, colour and imagery. This book does not set out to teach lessons, but it is full of wisdom and insight collected from all over the world. Describing himself as a visual jackdaw, master designer Alan Fletcher has distilled a lifetime of experience and reflection into a brilliantly witty and inimitable exploration of such subjects as perception, colour, pattern, proportion, paradox, illusion, language, alphabets, words, letters, ideas, creativity, culture, style, aesthetics and value. The Art of Looking Sideways is the ultimate guide to visual awareness, a magical compilation that will entertain and inspire all those who enjoy the interplay between word and image, and who relish the odd and the unexpected.",0,Phaidon Press,2014-05-22 21:17:39 +0000,,0,0,2001-08-20 04:00:00 +0000,$49.95,0,,,,,0,,,,The Art of Looking Sideways,,CD8F5401-2885-4187-9731-2FF2A010484F,,0,5.38,8.5,http://ecx.images-amazon.com/images/I/513rglbFnmL.jpg
0029116023,Book,,,,,,us,"black, grey, white, brown, pink, light pink, tan, dark grey, dark green, light brown, dark purple, green, light grey, cream, off white, light blue, forest green, dark brown, dark blue, olive green, pale pink, beige, navy blue, orange",2014-05-22 17:32:21 +0000,David Gelernter,$0.01,,9780029116029,First Edition,,Hardcover,"Computers & Technology, Health, Fitness & Dieting, Medical Books",0.9,,0029116023,Book,,"English (Unknown), English (Original Language), English (Published)",9.5,,,0,0,0,0,1,,,211,,0,"Can we introduce emotion into the computer? David Gelernter, one of the leading lights in artificial intelligence today, begins ""The Muse in the Machine"" with this provocative question. In providing an answer, he not only points to a future revolution in computers but radically changes our views of the human mind itself. Bringing together insights from computer science, cognitive psychology, philosophy of mind, and literary theory, David Gelernter presents what is sure to be a much debated view of how humans have thought, how we think today, and how computers will learn to think in the future.",0,Free Press,2014-05-22 17:32:21 +0000,,0,0,1994-03-28 05:00:00 +0000,$22.95,0,,,,,0,,,,Muse in the Machine,,B86F9332-5A5B-4FCD-8393-96AB0B6F3E1C,,0,1.02,6.2,http://ecx.images-amazon.com/images/I/51N5776XJDL.jpg
0231149913,Book,,,,,,us,"white, light blue, pale blue, pink, light pink, grey, black, dark grey, blue",2014-05-22 17:18:28 +0000,Kenneth Goldsmith,$13.98,,9780231149914,,,Paperback,"Literature & Fiction, Reference, Politics & Social Sciences",0.6,,0231149913,Book,,"English (Unknown), English (Original Language), English (Published)",8.1,,,0,0,0,0,1,,,272,,0,"Can techniques traditionally thought to be outside the scope of literature, including word processing, databasing, identity ciphering, and intensive programming, inspire the reinvention of writing? The Internet and the digital environment present writers with new challenges and opportunities to reconceive creativity, authorship, and their relationship to language. Confronted with an unprecedented amount of texts and language, writers have the opportunity to move beyond the creation of new texts and manage, parse, appropriate, and reconstruct those that already exist., , In addition to explaining his concept of uncreative writing, which is also the name of his popular course at the University of Pennsylvania, Goldsmith reads the work of writers who have taken up this challenge. Examining a wide range of texts and techniques, including the use of Google searches to create poetry, the appropriation of courtroom testimony, and the possibility of robo-poetics, Goldsmith joins this recent work to practices that date back to the early twentieth century. Writers and artists such as Walter Benjamin, Gertrude Stein, James Joyce, and Andy Warhol embodied an ethos in which the construction or conception of a text was just as important as the resultant text itself. By extending this tradition into the digital realm, uncreative writing offers new ways of thinking about identity and the making of meaning.",0,Columbia University Press,2014-05-22 17:18:28 +0000,,0,0,2011-09-20 04:00:00 +0000,$23.95,0,,,,,0,,,,Uncreative Writing: Managing Language in the Digital Age,,6B603FB4-84BC-4545-B2AF-AFD6FF3CB27E,,0,0.68,5.4,http://ecx.images-amazon.com/images/I/41G1Qz6Vm-L.jpg
0201180758,Book,,,,,,us,"black, grey, dark green, dark grey, purple, blue, green, brown, dark purple, white, dark blue",2014-05-22 17:21:31 +0000,"Rafael C. Gonzalez, Richard E. Woods",$13.97,,9780201180756,2nd,,Hardcover,"Computers & Technology, Engineering & Transportation, Reference",1.3,,0201180758,Book,,"English (Unknown), English (Original Language), English (Published)",9.4,,,0,0,0,0,1,,,793,,0,"For courses in Image Processing and Computer Vision. Completely self-contained--and heavily illustrated--this introduction to basic concepts and methodologies for digital image processing is written at a level that truly is suitable for seniors and first-year graduate students in almost any technical discipline. The leading textbook in its field for more than twenty years, it continues its cutting-edge focus on contemporary developments in all mainstream areas of image processing--e.g., image fundamentals, image enhancement in the spatial and frequency domains, restoration, color image processing, wavelets, image compression, morphology, segmentation, image description, and the fundamentals of object recognition. It focuses on material that is fundamental and has a broad scope of application.",0,Prentice Hall,2014-05-22 17:21:31 +0000,,0,0,2002-01-15 05:00:00 +0000,$139.00,0,,,,,0,,(2nd Edition),,Digital Image Processing,,2A905B39-D4A7-4204-A845-8B66AD6B39AF,,0,2.97,7.2,http://ecx.images-amazon.com/images/I/51N31MA34EL.jpg
1558608354,Book,,,,,,us,"brown, black, dark brown, maroon, dark purple, yellow, orange, dark green, olive green",2014-05-22 17:07:28 +0000,David Gould,$3.85,,9781558608351,1,Used Book in Good Condition,Paperback,"Arts & Photography, Computers & Technology, Humor & Entertainment, Engineering & Transportation, Reference",1.1,,1558608354,Book,,"English (Unknown), English (Original Language), English (Published)",8.98,,,0,0,0,0,1,,,528,,0,"Learning Maya, the world's leading 3D animation and effects package, is a challenge, especially for those who want to master Maya's versatile programming features in addition to its built-in tools., , Finally, here is a practical, step-by-step guide that shows how to use Maya to its fullest potential, beginning with the basics. Readers of Complete Maya Programming will first gain a thorough understanding of Maya's inner workings, and then learn how to customize and extend Maya with scripts and plugins that take control and productivity to new levels., , Users new to programming can apply Maya's easy scripting language MEL (Maya Embedded Language), while more advanced users can work with the C++ API (Application Progamming Interface). Both a fundamental tutorial for Maya beginners and a solid reference for experienced developers, Complete Maya Programming is every user's guide to Maya mastery., , * Provides a multitude of real-world examples illustrating applications of Maya programming., * Demonstrates how to use MEL to control Maya, customize its interface, automate procedures, and more, * Details how to use the C++ API to modify Maya functionality and develop tools and features to meet any need, * Explains when to use MEL, when to use the C++ API, and how to use them together, * Ideal for technical directors, developers, or anyone wishing to to master Maya, * Provides a storehouse of MEL scripts and C++ source code, glossary, and list of resources, available at www.davidgould.com",0,Morgan Kaufmann,2014-05-22 17:07:28 +0000,,0,0,2003-01-02 05:00:00 +0000,$78.95,0,,,,,0,,(The Morgan Kaufmann Series in Computer Graphics),,Complete Maya Programming: An Extensive Guide to MEL and C++ API,,91251DF1-6DB8-4B37-8D35-FCBC4A322095,,0,1.85,7.32,http://ecx.images-amazon.com/images/I/51go6OBKAEL.jpg
0830617582,Book,,,,,,us,,2014-05-22 19:53:46 +0000,Calvin R. Graf,$6.13,,9780830617586,1,Used Book in Good Condition,Paperback,Science & Math,0.8,,0830617582,Book,,"English (Unknown), English (Original Language), English (Published)",8.199999999999999,,,0,0,0,0,1,,,210,,0,"Book by Graf, Calvin R.",0,Tab Books,2014-05-22 19:53:46 +0000,,0,0,1985-05-01 04:00:00 +0000,$10.95,0,,,,,0,,,,"Exploring Light, Radio and Sound Energy, With Projects",,A270D88B-235B-45B6-A7B5-AB112DC5909C,,0,0.45,5.1,
0789717263,Book,,,,,,us,"grey, white, light blue, brown, blue, pale blue, pink, black, tan, light brown, light pink, light grey, sky blue, green, dark blue, purple, beige, olive green",2014-05-22 21:04:37 +0000,Preston Gralla,$0.01,,9780789717269,4th,,Paperback,Computers & Technology,0.8,,0789717263,Book,,"English (Unknown), English (Original Language), English (Published)",10,,,0,0,0,0,1,,,320,,0,"Have you ever wanted to know how data travels from computer to computer, around the world? Have you ever wondered how web sites can track users or how newsgroups work? How the Internet Works not only tells the reader how it works, but show -One of the most popular four-color computer books of all time, How the Internet Works visually shows users how data travels over the Internet -Its full-color, detailed graphics explain to users of all levels first hand terms and technologies -Features the latest in Internet technology such as Instant Messaging, blocking Spam and data tracking",0,Que Pub,2014-05-22 21:04:37 +0000,,0,0,1998-09-01 04:00:00 +0000,$29.99,0,,,,,0,,,,How the Internet Works,,9125B9C8-BC96-44E3-9E58-3AF26808883C,,0,2.1,8.6,http://ecx.images-amazon.com/images/I/51MWEVZ1JBL.jpg
0878933913,Book,,,,,,us,"grey, black, white, brown, dark grey, pink, red, light grey, light pink, purple, light blue, dark green, green, dark purple, beige, tan, lavender",2014-05-22 17:37:52 +0000,"Steven Haddock, Casey Dunn",$56.70,,9780878933914,First,Used Book in Good Condition,Paperback,"Computers & Technology, Science & Math",1,,0878933913,Book,,"English (Unknown), English (Original Language), English (Published)",9,,,0,0,0,0,1,,,538,,0,"Increasingly, scientists find themselves facing exponentially larger data sets and analyses without suitable tools to deal with them. Many biologists end up using spreadsheet programs for most of their data-processing tasks and spend hours clicking around or copying and pasting, and then repeating the process for other data files., , Practical Computing for Biologists shows you how to use many freely available computing tools to work more powerfully and effectively. The book was born out of the authors' own experience in developing tools for their research and helping other biologists with their computational problems. Although many of the techniques are relevant to molecular bioinformatics, the motivation for the book is much broader, focusing on topics and techniques that are applicable to a range of scientific endeavors. Twenty-two chapters organized into six parts address these topics and more: Searching with regular expressionsThe Unix command linePython programming and debuggingCreating and editing graphicsDatabasesPerforming analyses on remote serversWorking with electronics, , While most of the concepts and examples apply to any operating system, the main narrative focuses on Mac OS X. Where there are differences for Windows and Linux users, parallel instructions are provided in the margin and in an appendix. The book is designed to be used as a self-guided resource for researchers, a companion book in a course, or as a primary textbook. Practical Computing for Biologists will free you from the most frustrating and time-consuming aspects of data processing so you can focus on the pleasures of scientific inquiry.",0,"Sinauer Associates, Inc.",2014-05-22 17:37:52 +0000,,0,0,2010-11-05 04:00:00 +0000,$67.95,0,,,,,0,,,,Practical Computing for Biologists,,2087FC5E-0F83-4B2A-AEC4-C0555D73AE94,,0,2.64,7.6,http://ecx.images-amazon.com/images/I/41-DVA3oUeL.jpg
1617290181,Book,,,,,,us,"grey, dark grey, dark green, green, blue, forest green, light blue, black, beige, brown, pink, tan, dark blue, navy blue, purple, sky blue, light pink",2014-05-22 17:22:32 +0000,Peter Harrington,$22.95,,9781617290183,1,,Paperback,"Computers & Technology, Reference",0.9,,1617290181,Book,,"English (Unknown), English (Original Language), English (Published)",9.199999999999999,,,0,0,0,0,1,,,384,,0,"Summary, , Machine Learning in Action is unique book that blends the foundational theories of machine learning with the practical realities of building tools for everyday data analysis. You'll use the flexible Python programming language to build programs that implement algorithms for data classification, forecasting, recommendations, and higher-level features like summarization and simplification. About the Book, , A machine is said to learn when its performance improves with experience. Learning requires algorithms and programs that capture data and ferret out the interesting or useful patterns. Once the specialized domain of analysts and mathematicians, machine learning is becoming a skill needed by many., , Machine Learning in Action is a clearly written tutorial for developers. It avoids academic language and takes you straight to the techniques you'll use in your day-to-day work. Many (Python) examples present the core algorithms of statistical data processing, data analysis, and data visualization in code you can reuse. You'll understand the concepts and how they fit in with tactical tasks like classification, forecasting, recommendations, and higher-level features like summarization and simplification., , Readers need no prior experience with machine learning or statistical processing. Familiarity with Python is helpful., , Purchase of the print book comes with an offer of a free PDF, ePub, and Kindle eBook from Manning. Also available is all code from the book. What's InsideA no-nonsense introductionExamples showing common ML tasksEveryday data analysisImplementing classic algorithms like Apriori and AdaboosTable of ContentsPART 1 CLASSIFICATION Machine learning basicsClassifying with k-Nearest NeighborsSplitting datasets one feature at a time: decision treesClassifying with probability theory: naïve BayesLogistic regressionSupport vector machinesImproving classification with the AdaBoost meta algorithmPART 2 FORECASTING NUMERIC VALUES WITH REGRESSION Predicting numeric values: regressionTree-based regressionPART 3 UNSUPERVISED LEARNING Grouping unlabeled items using k-means clusteringAssociation analysis with the Apriori algorithmEfficiently finding frequent itemsets with FP-growthPART 4 ADDITIONAL TOOLS Using principal component analysis to simplify dataSimplifying data with the singular value decompositionBig data and MapReduce",0,Manning Publications,2014-05-22 17:22:32 +0000,,0,0,2012-04-16 04:00:00 +0000,$44.99,0,,,,,0,,,,Machine Learning in Action,,EE45FEF2-2ACF-49B1-A940-83A1A40DBAE5,,0,1.44,7.3,http://ecx.images-amazon.com/images/I/41MS9I6H1ZL.jpg
0596809484,Book,,,,,,us,"purple, magenta, pink, grey, black, dark purple, white, dark grey, brown, light pink",2014-05-22 17:24:42 +0000,Kevlin Henney,$13.14,,9780596809485,1,Used Book in Good Condition,Paperback,"Computers & Technology, Reference",0.71,,0596809484,Book,,"English (Unknown), English (Original Language), English (Published)",8.74,,,0,0,0,0,1,,,258,,0,"Tap into the wisdom of experts to learn what every programmer should know, no matter what language you use. With the 97 short and extremely useful tips for programmers in this book, you'll expand your skills by adopting new approaches to old problems, learning appropriate best practices, and honing your craft through sound advice., , With contributions from some of the most experienced and respected practitioners in the industry--including Michael Feathers, Pete Goodliffe, Diomidis Spinellis, Cay Horstmann, Verity Stob, and many more--this book contains practical knowledge and principles that you can apply to all kinds of projects., , A few of the 97 things you should know: ""Code in the Language of the Domain"" by Dan North""Write Tests for People"" by Gerard Meszaros""Convenience Is Not an -ility"" by Gregor Hohpe""Know Your IDE"" by Heinz Kabutz""A Message to the Future"" by Linda Rising""The Boy Scout Rule"" by Robert C. Martin (Uncle Bob)""Beware the Share"" by Udi Dahan",0,O'Reilly Media,2014-05-22 17:24:42 +0000,,0,0,2010-02-22 05:00:00 +0000,$29.99,0,,,,,0,,,,97 Things Every Programmer Should Know: Collective Wisdom from the Experts,,DF849323-8AAB-4F60-88D2-0A8EBCB3F77F,,0,0.78,5.91,http://ecx.images-amazon.com/images/I/51uSFVY7zjL.jpg
9076492026,Book,,,,,,us,"grey, purple, brown, mauve, dark grey, dark purple, blue, light grey, pink, lavender, light blue, light pink",2014-05-22 21:16:08 +0000,"Kay Hofmeester, Esther De St.Germain",$94.99,,9789076492025,,,Paperback,Arts & Photography,0.73,,9076492026,Book,,"English (Unknown), English (Original Language), English (Published)",8.43,,,0,0,0,0,1,,,180,,0,,0,Netherlands Design Institute,2014-05-22 21:16:08 +0000,,0,0,2000-03-01 05:00:00 +0000,,0,,,,,0,,,,Presence: New Media for Older People,,A3A4A392-4B8C-4B07-9DD8-20FB99C46A08,,0,0.79,9.43,
B0010CZ3U4,eBooks,,,,,,us,"white, red, yellow, blue, pink, light pink, dark blue, light blue, grey, pale blue, black, brown, orange, dark grey",2014-05-22 20:47:19 +0000,John R. Hubbard,,,,2,,Kindle Edition,"Computers & Technology, Education & Teaching, Kindle eBooks",0,,,Book,,English (Published),0,,,0,0,0,0,1,,,384,,0,"Updated to include information on the Scanner class, autoboxing, static imports, and loopsIncludes more than 260 solved problems and examplesCovers the Advanced Placement exam in computer science, now entirely in Java",0,McGraw-Hill,2014-05-22 20:47:19 +0000,,0,0,2007-06-11 04:00:00 +0000,,0,,,,,0,,,,"Schaum's Outline of Data Structures with Java, Second Edition",,066A5384-3CE5-4F60-8EB3-A66BF0E7143E,,0,0,0,http://ecx.images-amazon.com/images/I/51U5mrVNfqL.jpg
