amazon link,amazon product group,audience,cinematographer,composer,condition,conductor,country,cover color,creation date,creator,current value,dewey decimal,EAN,edition,features,format,genres,height,illustrator,ISBN,item type,key,languages,length,library of congress,location,maximum players,minimum players,net rating,no. in series,no. of items,notes,owner,pages,platform,played / read,primary synopsis,private,publisher,purchase date,purchase price,rare,rating,release date,retail price,running time,screenwriter,serial number,series,shelves,signed,stars,subtitle,theatrical debut,title,tracks,unique item key,url,used,weight,width,your image URL
1849518041,Book,,,,,,us,"black, grey, purple, green, orange, dark green, dark purple, brown, olive green, forest green, dark blue, lavender, navy blue, dark grey, dark brown, light purple, tan, blue",2014-05-22 17:39:55 +0000,Denis Perevalov,$54.55,,9781849518048,,,Paperback,"Computers & Technology, Reference",1.02,,1849518041,Book,,"English (Unknown), English (Original Language), English (Published)",9.210000000000001,,,0,0,0,0,1,,,364,,0,"A practical guide to creating audiovisual interactive projects with low-level data processing using openFrameworks Create cutting edge audio-visual interactive projects, interactive installations, and sound art projects with easeUnleash the power of low-level data processing methods using C++ and shadersMake use of the next generation technologies and techniques in your projects involving OpenCV, Microsoft Kinect, and so on, , In Detail, , openFrameworks is a powerful programming toolkit and library designed to assist the creative process through simplicity and intuitiveness. It's a very handy software library written in C++ to reduce the software development process, helping you kick-start creative coding. This tutorial presents key areas in a clear and practical manner with interesting examples to begin building your own visually impactful and interactive openFrameworks projects., , ""Mastering OpenFrameworks: Creative Coding Demystified"" is a great way to learn to develop stunning and interactive applications, all using openFrameworks. This book presents key development techniques and practical examples to gain inspiration for your future projects and take your creativity to the next level. This book will unlock secrets to program visually impactful and interactive openFrameworks projects, like never before., , ""Mastering openFrameworks: Creative Coding Demystified"" provides a complete introduction to openFrameworks, including installation, core capabilities, and addons. Advanced topics like shaders, computer vision, and depth cameras are also covered., , We start off by discussing the basic topics such as image and video loading, rendering and processing, playing sound samples, and synthesizing new sounds. We then move on to cover 3D graphics, computer vision, and depth cameras. You will also learn a number of advanced topics such as video mapping, interactive floors and walls, video morphing, networking, and using geometry shaders., , You will learn everything you need to know in order to create your own projects; create projects of all levels, ranging from simple creative-code experiments, to big interactive systems consisting of a number of computers, depth cameras, and projectors., , What will you learn from this bookInstall openFrameworks in Windows, Mac OS X, and LinuxLoad images and videos from files, and learn rendering and low-level processingLearn to use sound samples, sound synthesizing, and how to record sounds from a microphoneWork with 3D graphics, including shadersExtend your project with additional graphics, sound, networking, and computer vision functionality with the help of numerous openFrameworks addonsCreate distributed projects, which work on a several computers by synchronizing via OSC protocolLeverage computer vision basics, including optical flow, and perspective transformationsUse depth cameras, like Microsoft Kinect, for creating interactive walls, , Approach, , Stuffed with practical examples, this book gives clear and effective instructions to build your own fun, stunning, and highly-interactive openFrameworks applications. Each chapter is focused on one topic and has a new theme to it., , Who this book is written for, , If you are a visual artist, designer, or programmer interested in creative coding with openFrameworks then this book is for you. Basic knowledge of object-oriented programming, such as C++, Java, Python, and ActionScript 3, would be helpful.",0,Packt Publishing,2014-05-22 17:39:55 +0000,,0,0,2013-09-23 04:00:00 +0000,$49.99,0,,,,,0,,,,Mastering openFrameworks: Creative Coding Demystified,,8A8C9E93-D713-4135-B547-8127EEDA7AC4,,0,1.38,7.48,http://ecx.images-amazon.com/images/I/51XRVi09DOL.jpg
0735611319,Book,,,,,,us,"beige, tan, grey, brown, white, light brown, cream, pink, light pink, blue, off white, peach",2014-05-22 17:37:56 +0000,Charles Petzold,$4.35,,9780735611313,1,,Paperback,"Computers & Technology, Reference",1.34,,0735611319,Book,,"English (Unknown), English (Original Language), English (Published)",8.9,,,0,0,0,0,1,,,400,,0,"What do flashlights, the British invasion, black cats, and seesaws have to do with computers? In CODE, they show us the ingenious ways we manipulate language and invent new means of communicating with each other. And through CODE, we see how this ingenuity and our very human compulsion to communicate have driven the technological innovations of the past two centuries., Using everyday objects and familiar language systems such as Braille and Morse code, author Charles Petzold weaves an illuminating narrative for anyone who’s ever wondered about the secret inner life of computers and other smart machines., It’s a cleverly illustrated and eminently comprehensible story—and along the way, you’ll discover you’ve gained a real context for understanding today’s world of PCs, digital media, and the Internet. No matter what your level of technical savvy, CODE will charm you—and perhaps even awaken the technophile within.",0,Microsoft Press,2014-05-22 17:37:56 +0000,,0,0,2000-10-21 04:00:00 +0000,$17.99,0,,,,,0,,,,Code: The Hidden Language of Computer Hardware and Software,,8FA1DCCA-86EC-4376-BEB5-1D1050E249DB,,0,1.15,5.91,http://ecx.images-amazon.com/images/I/310WZuKyEUL.jpg
0596805888,Book,,,,,,us,"beige, tan, grey, pink, peach, light pink, brown, black, blue, salmon, dark purple, dark grey, dark brown, purple",2014-05-22 17:38:34 +0000,Jeff Potter,$5.83,,9780596805883,1,,Paperback,"Computers & Technology, Cookbooks, Food & Wine, Science & Math",0.87,,0596805888,Book,,"English (Unknown), English (Original Language), English (Published)",9.25,,,0,0,0,0,1,,,432,,0,"Are you the innovative type, the cook who marches to a different drummer -- used to expressing your creativity instead of just following recipes? Are you interested in the science behind what happens to food while it's cooking? Do you want to learn what makes a recipe work so you can improvise and create your own unique dish?, , More than just a cookbook, Cooking for Geeks applies your curiosity to discovery, inspiration, and invention in the kitchen. Why is medium-rare steak so popular? Why do we bake some things at 350 F/175 C and others at 375 F/190 C? And how quickly does a pizza cook if we overclock an oven to 1,000 F/540 C? Author and cooking geek Jeff Potter provides the answers and offers a unique take on recipes -- from the sweet (a ""mean"" chocolate chip cookie) to the savory (duck confit sugo)., , This book is an excellent and intriguing resource for anyone who wants to experiment with cooking, even if you don't consider yourself a geek. Initialize your kitchen and calibrate your toolsLearn about the important reactions in cooking, such as protein denaturation, Maillard reactions, and caramelization, and how they impact the foods we cookPlay with your food using hydrocolloids and sous vide cookingGain firsthand insights from interviews with researchers, food scientists, knife experts, chefs, writers, and more, including author Harold McGee, TV personality Adam Savage, chemist Hervé This, and xkcd, , From Cooking for Geeks: Butternut Squash Soup, , Purée in a food processor or with an immersion blender:, 2 cups (660g) butternut squash, peeled, cubed, and roasted (about 1 medium squash), 2 cups (470g) chicken, turkey, or vegetable stock, 1 small (130g) yellow onion, diced and sautéed, 1/2 teaspoon (1g) salt (adjust to taste), , Notes The weights are for the prepared ingredients and only rough suggestions. So, prepare each item individually. For example, for the squash, peel it, then coat it with olive oil, sprinkle it with salt, and roast it in the oven at a temperature around 400–425 F / 200–220 C until it begins to brown. When you go to purée the ingredients, hold back some of the squash and some of the stock, taste the purée, and see which you think it needs. Want it thicker? Add more squash. Thinner? Add more stock.This soup by itself is very basic. Garnish with whatever else you have on hand that you think might go well, such as garlic croutons and bacon. Or top with a small dab of cream, some toasted walnuts, and dried cranberries to give it a feeling of Thanksgiving. How about a teaspoon of maple syrup, a few thin slices of beef, and some fresh oregano? Chives, sour cream, and cheddar cheese? Why not! Instead of purchasing items to follow a recipe exactly, try using leftover ingredients from other meals to complement the squash soup.If you’re in a rush, you can “jump-start” the squash by microwaving it first. Peel and quarter the squash, using a spoon to scoop out the seeds. Then, cube it into 1–2” / 3–5 cm pieces, drop it into a glass baking pan that’s both oven and microwave safe, and nuke it for four to five minutes to partially heat the mass. Remove from microwave, coat the squash with olive oil and a light sprinkling of salt, and roast it in a preheated oven until done, about 20 to 30 minutes. If you’re not in a rush, you can skip the peeling step entirely: cut the squash in half, scoop out the seeds, add oil and salt, roast it for about an hour (until the flesh is soft), and use a spoon to scoop it out., , Pumpkin Cake, , There are two broad types of cake batters: high- ratio cakes--those that have more sugar and water than flour (or by some definitions, just a lot of sugar)--and low-ratio cakes—which tend to have coarser crumbs. For high-ratio cakes, there should be more sugar than flour (by weight) and more eggs than fats (again, by weight), and the liquid mass (eggs, milk, water) should be heavier than the sugar., , Consider this pumpkin cake, which is a high-ratio cake (245g of pumpkin contains 220g of water--you can look these sorts of things up in the USDA National Nutrient Database, available online at http://www.nal.usda.gov/fnic/foodcomp/search/)., , In a mixing bowl, measure out and then mix with an electric mixer to thoroughly combine:, 1 cup (245g) pumpkin (canned, or roast and puree your own), 1 cup (200g) sugar, 3/4 cup (160g) canola oil, 2 large (120g) eggs, 1 1/2 cups (180g) flour, 1/4 cup (40g) raisins, 2 teaspoons (5g) cinnamon, 1 teaspoon (5g) baking powder, 1/2 teaspoon (5g) baking soda, 1/2 teaspoon (3g) salt, 1/2 teaspoon (2g) vanilla extract, , Transfer to a greased cake pan or spring form and bake in an oven preheated to 350 F / 175 C until a toothpick comes out dry, about 20 minutes., , Notes Try adding dried pears soaked in brandy. You can also hold back some of the raisins and sprinkle them on top.One nice thing about high-ratio cakes is that they don’t have much gluten, so they won’t turn out like bread, even with excessive beating. With a total weight of 920 grams, of which only roughly 20 grams is gluten, there just isn’t enough gluten present in this cake to give it a bread-like texture. There’s also a fair amount of both sugar and fats to interfere with gluten development.",0,O'Reilly Media,2014-05-22 17:38:34 +0000,,0,0,2010-08-12 04:00:00 +0000,$34.99,0,,,,,0,,,,"Cooking for Geeks: Real Science, Great Hacks, and Good Food",,F55EE662-3676-4BB9-8F04-8A798DE460B0,,0,2.1,8.029999999999999,http://ecx.images-amazon.com/images/I/51pevMm2GdL.jpg
144937980X,Book,,,,,,us,"white, light blue, blue, grey, sky blue, yellow, pink, pale blue, light pink, orange, black, dark grey, teal, red",2014-05-22 20:49:59 +0000,"Casey Reas, Ben Fry",$4.92,,9781449379803,1,"ISBN13: 9781449379803, Condition: New",Paperback,"Computers & Technology, Reference",0.6,,144937980X,Book,,"English (Unknown), English (Original Language), English (Published)",8.4,,,0,0,0,0,1,,,210,,0,"Learn computer programming the easy way with Processing, a simple language that lets you use code to create drawings, animation, and interactive graphics. Programming courses usually start with theory, but this book lets you jump right into creative and fun projects. It's ideal for anyone who wants to learn basic programming, and serves as a simple introduction to graphics for people with some programming skills., , Written by the founders of Processing, this book takes you through the learning process one step at a time to help you grasp core programming concepts. You'll learn how to sketch with code -- creating a program with one a line of code, observing the result, and then adding to it. Join the thousands of hobbyists, students, and professionals who have discovered this free and educational community platform. Quickly learn programming basics, from variables to objectsUnderstand the fundamentals of computer graphicsGet acquainted with the Processing software development environmentCreate interactive graphics with easy-to-follow projectsUse the Arduino open source prototyping platform to control your Processing graphics",0,"Maker Media, Inc",2014-05-22 20:49:59 +0000,,0,0,2010-07-05 04:00:00 +0000,$19.99,0,,,,,0,,,,Getting Started with Processing,,D16711F1-EEC9-4C91-803E-6B50F8751DC6,,0,0.5,5.4,http://ecx.images-amazon.com/images/I/51NwGhn%2B0-L.jpg
,,,,,,,us,"pink, peach, purple, grey, mauve, salmon, tan, beige, light pink, red, white, magenta, maroon, rose, black, dark pink, light grey, dark purple, dark grey, pale pink, brown",2014-05-22 21:14:13 +0000,Kent Reisdorph,,,,,,,,0,,,Book,,,0,,,0,0,0,0,1,,,0,,0,,0,,2014-05-22 21:14:13 +0000,,0,0,,,0,,,,,0,,,,Sams Teach Yourself C++ in 5 Days,,074FCF2A-353D-434F-9B8F-8E8469468F3E,,0,0,0,
1449344216,Book,,,,,,us,"white, light blue, grey, pink, light pink, pale blue, black, blue, sky blue, yellow, dark grey",2014-05-22 17:08:38 +0000,"Matt Richardson, Shawn Wallace",$10.68,,9781449344214,1,,Paperback,"Computers & Technology, Engineering & Transportation, Reference, Education & Teaching",0.47,,1449344216,Book,,"English (Unknown), English (Original Language), English (Published)",8.43,,,0,0,0,0,1,,,176,,0,"What can you do with the Raspberry Pi, a $35 computer the size of a credit card? All sorts of things! If you’re learning how to program, or looking to build new electronic projects, this hands-on guide will show you just how valuable this flexible little platform can be., , This book takes you step-by-step through many fun and educational possibilities. Take advantage of several preloaded programming languages. Use the Raspberry Pi with Arduino. Create Internet-connected projects. Play with multimedia. With Raspberry Pi, you can do all of this and more. Get acquainted with hardware features on the Pi’s boardLearn enough Linux to move around the operating systemPick up the basics of Python and Scratch—and start programmingDraw graphics, play sounds, and handle mouse events with the Pygame frameworkUse the Pi’s input and output pins to do some hardware hackingDiscover how Arduino and the Raspberry Pi complement each otherIntegrate USB webcams and other peripherals into your projectsCreate your own Pi-based web server with Python",0,"Maker Media, Inc",2014-05-22 17:08:38 +0000,,0,0,2013-01-03 05:00:00 +0000,$14.99,0,,,,,0,,(Make: Projects),,Getting Started with Raspberry Pi,,1566D6CA-4B0A-4F0D-9D6D-06137C4DA5D2,,0,0.46,5.51,http://ecx.images-amazon.com/images/I/51itwAkRt0L.jpg
0262680823,Book,,,,,,us,"black, brown, dark purple, dark green, dark brown, forest green, dark blue, navy blue, purple, grey, maroon, blue, dark grey",2014-05-22 17:08:08 +0000,Curtis Roads,$30.00,,9780262680820,0,"Shipping Weight: 5.40 lbs, Manufacturer:, Genre:",Paperback,"Arts & Photography, Computers & Technology, Reference",2.28,,0262680823,Book,,"English (Unknown), English (Original Language), English (Published)",9.92,,,0,0,0,0,1,,,1234,,0,"The Computer Music Tutorial is a comprehensive text and reference that covers all aspects of computer music, including digital audio, synthesis techniques, signal processing, musical input devices, performance software, editing systems, algorithmic composition, MIDI, synthesizer architecture, system interconnection, and psychoacoustics. A special effort has been made to impart an appreciation for the rich history behind current activities in the field.Profusely illustrated and exhaustively referenced and cross-referenced, The Computer Music Tutorial provides a step-by-step introduction to the entire field of computer music techniques. Written for nontechnical as well as technical readers, it uses hundreds of charts, diagrams, screen images, and photographs as well as clear explanations to present basic concepts and terms. Mathematical notation and program code examples are used only when absolutely necessary. Explanations are not tied to any specific software or hardware.Curtis Roads has served as editor-in-chief of Computer Music Journal for more than a decade and is a recognized authority in the field. The material in this book was compiled and refined over a period of several years of teaching in classes at Harvard University, Oberlin Conservatory, the University of Naples, IRCAM, Les Ateliers UPIC, and in seminars and workshops in North America, Europe, and Asia.",0,The MIT Press,2014-05-22 17:08:08 +0000,,0,0,1996-02-27 05:00:00 +0000,$79.00,0,,,,,0,,(Technology),,The Computer Music Tutorial,,CBC6B134-8DFD-4CC0-8D38-E7E1C67300AA,,0,4.43,7.8,http://ecx.images-amazon.com/images/I/41x0ys1%2BY3L.jpg
0262681544,Book,,,,,,us,"brown, light brown, maroon",2014-05-22 17:37:48 +0000,Curtis Roads,$17.30,,9780262681544,,,Paperback,"Arts & Photography, Computers & Technology, Reference, Science & Math",0.8,,0262681544,Book,,"English (Unknown), English (Original Language), English (Published)",8.9,,,0,0,0,0,1,,,424,,0,"Below the level of the musical note lies the realm of microsound, of sound particles lasting less than one-tenth of a second. Recent technological advances allow us to probe and manipulate these pinpoints of sound, dissolving the traditional building blocks of music -- notes and their intervals -- into a more fluid and supple medium. The sensations of point, pulse (series of points), line (tone), and surface (texture) emerge as particle density increases. Sounds coalesce, evaporate, and mutate into other sounds.Composers have used theories of microsound in computer music since the 1950s. Distinguished practitioners include Karlheinz Stockhausen and Iannis Xenakis. Today, with the increased interest in computer and electronic music, many young composers and software synthesis developers are exploring its advantages. Covering all aspects of composition with sound particles, Microsound offers composition theory, historical accounts, technical overviews, acoustical experiments, descriptions of musical works, and aesthetic reflections. The book is accompanied by an audio CD of examples.",0,The MIT Press,2014-05-22 17:37:48 +0000,,0,0,2004-08-20 04:00:00 +0000,$36.00,0,,,,,0,,,,Microsound,,9AD241A0-5154-41F5-98DF-717EBAE08377,,0,1.72,8,http://ecx.images-amazon.com/images/I/515GWCGM8GL.jpg
389955082X,Book,,,,,,us,"grey, black, dark grey, purple, dark purple, green, brown, teal, dark blue, blue, dark green, pink, navy blue, mauve, tan, orange, beige, forest green, red, olive green",2014-05-22 17:34:36 +0000,"Aslak Gurholt Ronsen, Espen Friberg",$30.93,,9783899550825,,Used Book in Good Condition,Paperback,Arts & Photography,0.63,,389955082X,Book,,"English (Unknown), English (Original Language), English (Published)",10.71,,,0,0,0,0,1,,,139,,0,"Yokoland, , Young Norwegian designers Aslak Gurholt Rønsen and Espen Friberg, who have been collaborating on projects since they met in high school at the age of 16, inhabit Yokoland. Together they create design, illustration and art that are idyllic, humorous and poetic without ever being mawkish some of which has been featured in Hidden Track. Being one of the most inventive design studios of today, Yokoland skillfully blends their Scandinavian approach to design into their work melding elegant humor and human touch, exploring new ways of creating graphic design solutions to stunning effect., , This book takes you on their adventures and features the best of Yokoland’s work containing a range of their as yet relatively unknown work that brings different styles and surprising contrasts in a highly original way. Yokoland’s distinctive design can be aptly summarized by their record label’s company slogan: ""We’re so underground that we’re almost in China"".",0,Gestalten Verlag,2014-05-22 17:34:36 +0000,,0,0,2006-02-01 05:00:00 +0000,$45.00,0,,,,,0,,,,Yokoland,,04758333-FFF3-4692-8ACF-929E94DD94BA,,0,1.59,8.5,http://ecx.images-amazon.com/images/I/61sxqoq91DL.jpg
0321334892,Book,,,,,,us,"orange, grey, blue, black, tan, dark blue, purple, brown, yellow, dark grey, light orange, white, light blue, dark purple, navy blue, beige, dark green, green, red, pink, mustard, peach, sky blue, gold",2014-05-22 17:07:00 +0000,Randi J. Rost,$0.14,,9780321334893,2,,Paperback,"Computers & Technology, Reference",1.97,,0321334892,Book,,"English (Unknown), English (Original Language), English (Published)",9.130000000000001,,,0,0,0,0,1,,,800,,0,"""As the 'Red Book' is known to be the gold standard for OpenGL, the 'Orange Book' is considered to be the gold standard for the OpenGL Shading Language. With Randi's extensive knowledge of OpenGL and GLSL, you can be assured you will be learning from a graphics industry veteran. Within the pages of the second edition you can find topics from beginning shader development to advanced topics such as the spherical harmonic lighting model and more."", , —David Tommeraasen, CEO/Programmer, Plasma Software, , ""This will be the definitive guide for OpenGL shaders; no other book goes into this detail. Rost has done an excellent job at setting the stage for shader development, what the purpose is, how to do it, and how it all fits together. The book includes great examples and details, and good additional coverage of 2.0 changes!"", , —Jeffery Galinovsky, Director of Emerging Market Platform Development, Intel Corporation, , ""The coverage in this new edition of the book is pitched just right to help many new shader-writers get started, but with enough deep information for the 'old hands.'"", , —Marc Olano, Assistant Professor, University of Maryland, , ""This is a really great book on GLSL—well written and organized, very accessible, and with good real-world examples and sample code. The topics flow naturally and easily, explanatory code fragments are inserted in very logical places to illustrate concepts, and all in all, this book makes an excellent tutorial as well as a reference."", , —John Carey, Chief Technology Officer, C.O.R.E. Feature Animation, , OpenGL® Shading Language, Second Edition, extensively updated for OpenGL 2.0, is the experienced application programmer's guide to writing shaders. Part reference, part tutorial, this book thoroughly explains the shift from fixed-functionality graphics hardware to the new era of programmable graphics hardware and the additions to the OpenGL API that support this programmability. With OpenGL and shaders written in the OpenGL Shading Language, applications can perform better, achieving stunning graphics effects by using the capabilities of both the visual processing unit and the central processing unit., , In this book, you will find a detailed introduction to the OpenGL Shading Language (GLSL) and the new OpenGL function calls that support it. The text begins by describing the syntax and semantics of this high-level programming language. Once this foundation has been established, the book explores the creation and manipulation of shaders using new OpenGL function calls., , OpenGL® Shading Language, Second Edition, includes updated descriptions for the language and all the GLSL entry points added to OpenGL 2.0; new chapters that discuss lighting, shadows, and surface characteristics; and an under-the-hood look at the implementation of RealWorldz, the most ambitious GLSL application to date. The second edition also features 18 extensive new examples of shaders and their underlying algorithms, including Image-based lightingLighting with spherical harmonicsAmbient occlusionShadow mappingVolume shadows using deferred lightingWard's BRDF model, , The color plate section illustrates the power and sophistication of the OpenGL Shading Language. The API Function Reference at the end of the book is an excellent guide to the API entry points that support the OpenGL Shading Language. Also included is a convenient Quick Reference Card to GLSL.",0,Addison-Wesley Professional,2014-05-22 17:07:00 +0000,,0,0,2006-02-04 05:00:00 +0000,$69.99,0,,,,,0,,(2nd Edition),,OpenGL® Shading Language,,AC39E83F-2DAE-4D87-9E89-04C685711C68,,0,0.66,6.93,http://ecx.images-amazon.com/images/I/51PQEHSA0XL.jpg
